[
  {
    "id": 1,
    "moduleSlug": "virgin-checkin-lead",
    "title": "Day 1: Landing at Head Office – Immersion & PSS Basics",
    "order": 1,
    "objectives": [
      "Navigate the Virgin Australia domain lexicon (PSS, PNR, DCS, Altéa)",
      "Explain the Next.js / React 19 Frontend architecture of the check-in web application",
      "Diagnose early symptoms of Impostor Syndrome and apply the 'Listen and Map' stakeholder protocol"
    ],
    "intro": "Welcome to Day 1 of your RPG onboarding. You arrive at the Virgin Australia Head Office in Brisbane (Bowen Hills). You are handed a security pass, a fresh laptop, and a cup of coffee. The atmosphere is energetic—planes are flying, operations are running 24/7, and you are the new Technical Lead for the critical Passenger Check-In Web Application.\n\nYour first meeting is with Sarah, the Senior Product Owner. She welcomes you but is noticeably stressed: 'The transition from the external vendor (TCS) needs to be fully completed before September. The business is nervous about stability, and we need you to be our technical anchor. Right now, our check-in app is highly dependent on Amadeus Altéa PSS, and the codebase feels like a black box.'\n\nSuddenly, your inner critic whispers: 'You don't know the airline domain. You don't know Amadeus Altéa. They are going to find out you're not ready for this.'\n\nTo succeed today, you must map the core system architecture, understand how the React check-in client talks to the Amadeus Passenger Service System (PSS), and establish your initial technical mapping without succumbing to impostor anxiety. You don't need to know everything on day one—your job is to ask the right questions.",
    "code": {
      "language": "typescript",
      "example": "// apps/web/src/apolloClient.ts\nimport { ApolloClient, InMemoryCache, createHttpLink, ApolloLink } from '@apollo/client';\nimport { setContext } from '@apollo/client/link/context';\nimport { getGraphQLEndpoint } from './lib/urlUtils';\n\n// Day 1 Tech Focus: Understanding the Front-end Client and Gateway proxy\n// The check-in web application communicates with Amadeus via our Fastify API proxy.\nconst httpLink = createHttpLink({\n  uri: getGraphQLEndpoint(), // Resolves to Next.js /api/graphql -> Fastify backend\n});\n\n// Authentication link injects the JWT token (backendToken) issued during sign-in\nconst authLink = setContext((_, { headers }) => {\n  const sessionToken = typeof window !== 'undefined' \n    ? localStorage.getItem('gc_backend_token') \n    : null;\n  \n  return {\n    headers: {\n      ...headers,\n      authorization: sessionToken ? `Bearer ${sessionToken}` : '',\n      'X-Airline-Code': 'VA', // Virgin Australia identifier\n      'X-Channel-ID': 'WEB_CHECKIN' // Identifies source of Amadeus PSS traffic\n    }\n  };\n});\n\nexport const client = new ApolloClient({\n  link: authLink.concat(httpLink),\n  cache: new InMemoryCache({\n    typePolicies: {\n      Passenger: {\n        keyFields: ['pnr', 'lastName'], // PNR (Passenger Name Record) is our primary domain key\n      },\n      FlightSegment: {\n        keyFields: ['flightNumber', 'departureDate', 'origin'],\n      }\n    }\n  })\n});",
      "explanation": "This code represents the core client connection. To understand the Virgin Australia check-in stack, note that the React web application never calls Amadeus Altéa directly. Instead, it utilizes Apollo Client to connect to our Next.js /api/graphql gateway, which proxies all secure requests to the Fastify backend API (the 'Technical Authority' layer). Inside the backend, integrations are established with the Amadeus Altéa PSS using secure SOAP/REST APIs.\n\nKey Domain Terms to Master:\n1. **PSS (Passenger Service System)**: The core airline database. Amadeus Altéa is the PSS used by Virgin Australia, managing inventory, reservations, and ticketing.\n2. **PNR (Passenger Name Record)**: A 6-character alphanumeric locator (e.g. 'VA8XYZ') representing the passenger's reservation data.\n3. **DCS (Departure Control System)**: The system that manages passenger check-in, bag drops, weight and balance calculations, and boarding pass generation at the airport.\n4. **Altéa Web Services**: The secure XML/SOAP/REST API gateway that allows our Node.js microservices to fetch reservations, assign seats, and manifest flights."
    },
    "pitfalls": [
      {
        "mistake": "Believing you must immediately know the entire Amadeus Altéa API catalog",
        "solution": "Amadeus Altéa is vast. Focus strictly on the core check-in flows: Retrieval by PNR/E-ticket, Seat Map display, Baggage registration, and Boarding Pass generation. Trust that your backend services abstract the SOAP complexity.",
        "severity": "medium"
      },
      {
        "mistake": "Accepting undocumented legacy terminology without asking for the business definition",
        "solution": "Build a shared domain glossary on Day 1. If someone says 'We have an issue with the SSRs on the flight,' ask them to clarify (SSR = Special Service Request, e.g., meal preferences or wheelchair assistance). Empathetic questioning builds trust.",
        "severity": "low"
      },
      {
        "mistake": "Suffering in silence when encountering a technical blocker to avoid appearing incompetent",
        "solution": "As Tech Lead, model transparency. Use the '15-minute rule': struggle with a problem for 15 minutes, document what you tried, then pull in team members or legacy docs. This reduces anxiety and solves issues faster.",
        "severity": "high"
      }
    ],
    "exercises": [
      {
        "title": "Onboarding RPG Action: Stakeholder Map & Domain Review",
        "description": "Initialize your Day 1 playbook by mapping the digital ecosystem and documenting your first architectural sketch.",
        "checkpoints": [
          "Locate the primary GraphQL endpoint routing in Next.js (/apps/web/src/lib/urlUtils.ts) and verify it correctly references getApiBaseStrict().",
          "Identify how PNR structures are represented in your schemas. Locate the cache keyFields to ensure proper front-end memoization.",
          "Set up your Day 1 documentation log outlining the key contacts: Sarah (Product), TCS Lead (Chennai), and the Enterprise Architect (Dave)."
        ]
      }
    ],
    "next": ["virgin-checkin-lead-lesson-2"],
    "estimatedMinutes": 45,
    "difficulty": "Advanced",
    "tags": ["Domain", "Amadeus", "Apollo", "Architecture", "Leadership"],
    "sources": [
      {
        "title": "Amadeus Altéa Departure Control System Overview",
        "url": "https://amadeus.com/en/portfolio/airlines/altea-departure-control-system-customer-management"
      },
      {
        "title": "Apollo Client Cache Configuration Guide",
        "url": "https://www.apollographql.com/docs/react/caching/cache-configuration/"
      }
    ],
    "lastUpdated": "2026-05-20T13:00:00.000Z",
    "version": "1.0.0"
  },
  {
    "id": 2,
    "moduleSlug": "virgin-checkin-lead",
    "title": "Day 2: Navigating the TCS Offshore Dynamic & Timezones",
    "order": 2,
    "objectives": [
      "Structure effective stand-ups and ceremonies across AEST (Brisbane) and IST (India) time zones",
      "Implement empathetic leadership techniques to overcome passive communication barriers ('yes-man' loops)",
      "Establish strict governance controls, code review workflows, and a modern Definition of Done (DoD)"
    ],
    "intro": "It is Day 2, 10:00 AM AEST (Aussie Eastern Standard Time). You are sitting in a conference room hosting your first virtual Stand-up with the TCS offshore development team in Chennai (where it is currently 5:30 AM IST).\n\nThe connection crackles. You ask Raj, the offshore tech lead, about the progress of the critical seat selection rewrite: 'Is the seat map caching logic ready for our performance testing?'\nRaj replies instantly: 'Yes, sir, we are working on it, it will be completed.'\nYou ask if they encountered any blockers with the Amadeus payload size.\nRaj pauses: 'No blockers, sir. We will deliver.'\n\nYour experience alerts you. In distributed teams, a rapid 'Yes' can sometimes hide deep blockages, time zone fatigue, or fear of reporting bad news. As the Technical Lead, you must build psychological safety, encourage open discussions about bugs, and set a robust, transparent code review standard. You are a partner, not a taskmaster. To bridge the gap, you need to transition from passive acceptance to active, collaborative verification.",
    "code": {
      "language": "javascript",